{"schema_version":3,"id":"v3-boundaries","name":"v3 边界","cases":[{"id":"guided-boundary","name":"引导边界","category":"recovery","environment":"fake","type":"guided_recovery","timeout":{"request_ms":60000,"case_ms":900000},"steps":[{"id":"disconnect","type":"operator_prompt","purpose":"disconnect_rs485","title":"断线","instruction":"断开 A/B。","safety_notice":"安全低压。","allowed_actions":["confirm","cancel"],"wait_timeout_ms":300000,"cancel_recovery_instruction":"恢复 A/B。"},{"id":"outage","type":"observe_outage","probe":{"function":3,"address":65535,"count":1},"interval_ms":10000,"deadline_ms":120000,"consecutive_matches":12},{"id":"reconnect","type":"operator_prompt","purpose":"reconnect_rs485","title":"重连","instruction":"接回 A/B。","safety_notice":"核对极性。","allowed_actions":["cancel","confirm"],"wait_timeout_ms":300000,"cancel_recovery_instruction":"保持正确接线。"},{"id":"recovery","type":"observe_recovery","probe":{"function":3,"address":65535,"count":1},"interval_ms":10000,"deadline_ms":120000,"consecutive_matches":12,"business_assertion":{"type":"equals","value":65535}}]}]}
